{
  "category_counts": {
    "asset": 90,
    "fixture": 3
  },
  "entries": [
    {
      "bytes": 149836,
      "id": "asset/apps/chataigne/icons/icon.ico",
      "kind": "asset",
      "name": "icon.ico",
      "path": "apps/chataigne/icons/icon.ico",
      "sha256": "6851c2a78f682f8f319d584b903bc6367201d52b9f3eb2eba8aade9c26504f0f"
    },
    {
      "bytes": 149814,
      "id": "asset/apps/chataigne/icons/icon.png",
      "kind": "asset",
      "name": "icon.png",
      "path": "apps/chataigne/icons/icon.png",
      "sha256": "63583425dd1763e23f451856bd1bfc023f4a16af68d762db232bb987643ce9e4"
    },
    {
      "bytes": 1569,
      "id": "asset/apps/chataigne/ui/src/lib/assets/favicon.svg",
      "kind": "asset",
      "name": "favicon.svg",
      "path": "apps/chataigne/ui/src/lib/assets/favicon.svg",
      "sha256": "d7d9227f0fe5bfb4189fb6ba4dd9e2d524f6a1dfd02bd901c65330987675c0b3"
    },
    {
      "bytes": 1822,
      "id": "asset/apps/chataigne/ui/src/lib/assets/icons/module/audio.svg",
      "kind": "asset",
      "name": "audio.svg",
      "path": "apps/chataigne/ui/src/lib/assets/icons/module/audio.svg",
      "sha256": "428dd1f4a27ccc9eb35770ac31dbd36e74b4795b75df20a5ffa96fd0071d97d7"
    },
    {
      "bytes": 973,
      "id": "asset/apps/chataigne/ui/src/lib/assets/icons/module/connected.svg",
      "kind": "asset",
      "name": "connected.svg",
      "path": "apps/chataigne/ui/src/lib/assets/icons/module/connected.svg",
      "sha256": "fc5fcfdc1835305431d97f976402c2dfdfd9271cb02a169592c66840e5e91365"
    },
    {
      "bytes": 2405,
      "id": "asset/apps/chataigne/ui/src/lib/assets/icons/module/controllers.svg",
      "kind": "asset",
      "name": "controllers.svg",
      "path": "apps/chataigne/ui/src/lib/assets/icons/module/controllers.svg",
      "sha256": "60ec456a5666c12f59e7142e6f365ed348bb6782d0e7a6325f111f523aa33ed3"
    },
    {
      "bytes": 1554,
      "id": "asset/apps/chataigne/ui/src/lib/assets/icons/module/disconnected.svg",
      "kind": "asset",
      "name": "disconnected.svg",
      "path": "apps/chataigne/ui/src/lib/assets/icons/module/disconnected.svg",
      "sha256": "2d74ac78e41c7b4319bbf6664bda294a47895c963c50efae46fcd60754781e51"
    },
    {
      "bytes": 1520,
      "id": "asset/apps/chataigne/ui/src/lib/assets/icons/module/generators.svg",
      "kind": "asset",
      "name": "generators.svg",
      "path": "apps/chataigne/ui/src/lib/assets/icons/module/generators.svg",
      "sha256": "ee162c7246c89f4de1965a1b2fd410d5baed297a9a655f6a6d17e7582c7c2df6"
    },
    {
      "bytes": 2361,
      "id": "asset/apps/chataigne/ui/src/lib/assets/icons/module/hardware.svg",
      "kind": "asset",
      "name": "hardware.svg",
      "path": "apps/chataigne/ui/src/lib/assets/icons/module/hardware.svg",
      "sha256": "5b26b61ceba5b2881acca2b224b7392932e93bb6ed3b0ba83327dfd937f06c76"
    },
    {
      "bytes": 718,
      "id": "asset/apps/chataigne/ui/src/lib/assets/icons/module/incoming.svg",
      "kind": "asset",
      "name": "incoming.svg",
      "path": "apps/chataigne/ui/src/lib/assets/icons/module/incoming.svg",
      "sha256": "44a289f63d468e174fd50bec50a30018130ac7c13df8989d76b5d762dd068f7a"
    },
    {
      "bytes": 2560,
      "id": "asset/apps/chataigne/ui/src/lib/assets/icons/module/network.svg",
      "kind": "asset",
      "name": "network.svg",
      "path": "apps/chataigne/ui/src/lib/assets/icons/module/network.svg",
      "sha256": "e2343c0eba9bc076dc90f9f4650509740d126100d741f2dda7243a1c9fe97602"
    },
    {
      "bytes": 719,
      "id": "asset/apps/chataigne/ui/src/lib/assets/icons/module/outgoing.svg",
      "kind": "asset",
      "name": "outgoing.svg",
      "path": "apps/chataigne/ui/src/lib/assets/icons/module/outgoing.svg",
      "sha256": "ad669738f50776d8ad3ff71c8513505aac01402265af37cea5b9d4f7e3a9e502"
    },
    {
      "bytes": 1886,
      "id": "asset/apps/chataigne/ui/src/lib/assets/icons/module/system.svg",
      "kind": "asset",
      "name": "system.svg",
      "path": "apps/chataigne/ui/src/lib/assets/icons/module/system.svg",
      "sha256": "7513997b7d8abe79392a87bd00421d17f5958e106bd57aed21b435528b342ed4"
    },
    {
      "bytes": 1440,
      "id": "asset/apps/chataigne/ui/src/lib/assets/icons/module/video.svg",
      "kind": "asset",
      "name": "video.svg",
      "path": "apps/chataigne/ui/src/lib/assets/icons/module/video.svg",
      "sha256": "2e6377389f6fe5662e40934679ad125d43fb4f7edcbf6d0582017e4b43dbd985"
    },
    {
      "bytes": 1328,
      "id": "asset/apps/chataigne/ui/src/lib/assets/icons/node-icons.svelte.ts",
      "kind": "asset",
      "name": "node-icons.svelte.ts",
      "path": "apps/chataigne/ui/src/lib/assets/icons/node-icons.svelte.ts",
      "sha256": "4c38b84925cd2f08590b8901f226288650ec7b0f7e97bffc6c3b4febb590db05"
    },
    {
      "bytes": 914,
      "id": "asset/apps/chataigne/ui/src/lib/assets/icons/nodes/app_control_module.svg",
      "kind": "asset",
      "name": "app_control_module.svg",
      "path": "apps/chataigne/ui/src/lib/assets/icons/nodes/app_control_module.svg",
      "sha256": "8795b0ada052b5435c222b3f0f90fcdaaf5b6f7822cb0463abd9edb18a450b88"
    },
    {
      "bytes": 14812,
      "id": "asset/apps/chataigne/ui/src/lib/assets/icons/nodes/buttplug_module.svg",
      "kind": "asset",
      "name": "buttplug_module.svg",
      "path": "apps/chataigne/ui/src/lib/assets/icons/nodes/buttplug_module.svg",
      "sha256": "9396fd6bc304e0d736083854da4f8ef3388d7c5b8f7f7c09eb2716fb79d5a46d"
    },
    {
      "bytes": 1811,
      "id": "asset/apps/chataigne/ui/src/lib/assets/icons/nodes/dmx_module.svg",
      "kind": "asset",
      "name": "dmx_module.svg",
      "path": "apps/chataigne/ui/src/lib/assets/icons/nodes/dmx_module.svg",
      "sha256": "e64bada0b6ebc27ddac9b4c45b84e0c3d0c2fbb8ba4c44856476db6a976d67fb"
    },
    {
      "bytes": 7116,
      "id": "asset/apps/chataigne/ui/src/lib/assets/icons/nodes/gamepad_module.svg",
      "kind": "asset",
      "name": "gamepad_module.svg",
      "path": "apps/chataigne/ui/src/lib/assets/icons/nodes/gamepad_module.svg",
      "sha256": "43c58fbc8c843678c6aaab7df7d218fd27ca7b42bcf4645ff52cca623e69f6e2"
    },
    {
      "bytes": 2218,
      "id": "asset/apps/chataigne/ui/src/lib/assets/icons/nodes/http_module.svg",
      "kind": "asset",
      "name": "http_module.svg",
      "path": "apps/chataigne/ui/src/lib/assets/icons/nodes/http_module.svg",
      "sha256": "8894500225cb0ef2e7f7efbd063e0fe321d35278762c4b5696792c85f81a8002"
    },
    {
      "bytes": 913,
      "id": "asset/apps/chataigne/ui/src/lib/assets/icons/nodes/joycon_module.svg",
      "kind": "asset",
      "name": "joycon_module.svg",
      "path": "apps/chataigne/ui/src/lib/assets/icons/nodes/joycon_module.svg",
      "sha256": "7d0251d1c6536c3139da126f4c9bc888ca527240638b34046c1262f173b60eb0"
    },
    {
      "bytes": 2370,
      "id": "asset/apps/chataigne/ui/src/lib/assets/icons/nodes/keyboard_module.svg",
      "kind": "asset",
      "name": "keyboard_module.svg",
      "path": "apps/chataigne/ui/src/lib/assets/icons/nodes/keyboard_module.svg",
      "sha256": "4bf6b9b369a8ed9497ecac208641c278f8682e84a560055fc5c7e658996ab7e7"
    },
    {
      "bytes": 926,
      "id": "asset/apps/chataigne/ui/src/lib/assets/icons/nodes/kinect2_module.svg",
      "kind": "asset",
      "name": "kinect2_module.svg",
      "path": "apps/chataigne/ui/src/lib/assets/icons/nodes/kinect2_module.svg",
      "sha256": "2f0ed20aaef99fc929141708000357330d3092763f48f19d0681d2c3ab6cae02"
    },
    {
      "bytes": 1687,
      "id": "asset/apps/chataigne/ui/src/lib/assets/icons/nodes/metronomes_module.svg",
      "kind": "asset",
      "name": "metronomes_module.svg",
      "path": "apps/chataigne/ui/src/lib/assets/icons/nodes/metronomes_module.svg",
      "sha256": "d008cd4a39fce84d40c8c539498236c1199c7a66d18f3444b9ef694ea9114b2f"
    },
    {
      "bytes": 1653,
      "id": "asset/apps/chataigne/ui/src/lib/assets/icons/nodes/midi_module.svg",
      "kind": "asset",
      "name": "midi_module.svg",
      "path": "apps/chataigne/ui/src/lib/assets/icons/nodes/midi_module.svg",
      "sha256": "ddde3863b74568ac7a630b88952b266846f8efbbc00a91b92784640523b386e7"
    },
    {
      "bytes": 1229,
      "id": "asset/apps/chataigne/ui/src/lib/assets/icons/nodes/module.svg",
      "kind": "asset",
      "name": "module.svg",
      "path": "apps/chataigne/ui/src/lib/assets/icons/nodes/module.svg",
      "sha256": "f8b699f7a6aa2dcc0d2adce90f1af75ff7e0c8362e0d3bb2481f833ac0e7d35d"
    },
    {
      "bytes": 1508,
      "id": "asset/apps/chataigne/ui/src/lib/assets/icons/nodes/module_manager.svg",
      "kind": "asset",
      "name": "module_manager.svg",
      "path": "apps/chataigne/ui/src/lib/assets/icons/nodes/module_manager.svg",
      "sha256": "7e452d2c5dff471539e1bf450d739f4a72e06564e1da490e70f13148fd0f2154"
    },
    {
      "bytes": 1205,
      "id": "asset/apps/chataigne/ui/src/lib/assets/icons/nodes/mouse_module.svg",
      "kind": "asset",
      "name": "mouse_module.svg",
      "path": "apps/chataigne/ui/src/lib/assets/icons/nodes/mouse_module.svg",
      "sha256": "ada557fa7d77a9fe49944e84ef1d8ab19588c29e157617d426043b8435f5bdb0"
    },
    {
      "bytes": 808,
      "id": "asset/apps/chataigne/ui/src/lib/assets/icons/nodes/mqtt_module.svg",
      "kind": "asset",
      "name": "mqtt_module.svg",
      "path": "apps/chataigne/ui/src/lib/assets/icons/nodes/mqtt_module.svg",
      "sha256": "4823c6087cd722fdb189781cc7ebe3e7e6cff26fc9d0274b13bd91b3e7c08f03"
    },
    {
      "bytes": 1730,
      "id": "asset/apps/chataigne/ui/src/lib/assets/icons/nodes/os_module.svg",
      "kind": "asset",
      "name": "os_module.svg",
      "path": "apps/chataigne/ui/src/lib/assets/icons/nodes/os_module.svg",
      "sha256": "18c6e1602f0031e06163de7b4cc4c1d89cf0636348d5fd2a3cafe3f98e053936"
    },
    {
      "bytes": 1399,